facility_id;state_id;lga_id;name;facility_type;address1;address2;phone1;phone2;email;pad_hospital_num;day_dqa;active;partner_ids;national_id;datim_id
812;3;69;ak Uyo St Athanasius Medical Centre;Urban;;0;;;;1;12;1;;;nnjEYKiOt3O
813;4;70;an Achina Comprehensive Health Centre;Rural;;0;;;;1;12;1;;;
814;4;70;an Achinna Primary Health Centre Oye;Rural;;0;;;;1;12;1;;;
815;4;70;an Aguata Primary Health Centre;Rural;;0;;;;1;12;1;;;vdq2GEoDaU6
816;4;70;an Aku Ezenifite Primary Health Centre;Rural;;0;;;;1;12;1;;;
817;4;70;an Amesi Primary Health Centre;Rural;;0;;;;1;12;1;;;
818;4;70;an Apex Medical Centre;Rural;;0;;;;1;12;1;;;ViydxSA0ReP
819;4;70;an Ave Maria Medical Centre;Rural;;0;;;;1;12;1;;;
820;4;70;an Chibuzo Maternity Hospital Ekwulobia;Rural;;0;;;;1;12;1;;;
821;4;70;an Chidera Model Hospital and Maternity Home;Rural;;0;;;;1;12;1;;;t2Nwu9XDk4d
822;4;70;an Chiemelie Hospital/Maternity;Rural;;0;;;;1;12;1;;;
823;4;70;an Ekwulobia General Hospital;Rural;;0;;;;1;12;1;;;Gxtwm2IUAvH
824;4;70;an Ifite Igboukwu Primary Health Centre;Rural;;0;;;;1;12;1;;;
825;4;70;an Igboukwu Diocesan Hospital;Rural;;0;;;;1;12;1;;;TtNU8zDQTqB
826;4;70;an Isi Ebele Achina Primary Health Centre;Rural;;0;;;;1;12;1;;;
827;4;70;an Jesse Hospital and Maternity Umuoru Uga;Rural;;0;;;;1;12;1;;;
828;4;70;an Kandudi Specialist Hospital;Rural;;0;;;;1;12;1;;;qtckkPtd1zQ
829;4;70;an Mkpologwu National Hospital;Rural;;0;;;;1;12;1;;;
830;4;70;an Nkpologwu Community Hospital;Rural;;0;;;;1;12;1;;;
831;4;70;an Nwajiaku Inland Hospital;Rural;;0;;;;1;12;1;;;
832;4;70;an Ogechukwu Hospital and Maternity Ekwulobia;Rural;;0;;;;1;12;1;;;
833;4;70;an Oraeri Primary Health Centre;Rural;;0;;;;1;12;1;;;
834;4;70;an St Marys Hospital;Rural;;0;;;;1;12;1;;;
835;4;70;an St. Patrick Hospital and Maternity Uga;Rural;;0;;;;1;12;1;;;
836;4;70;an Umuchu General Hospital;Rural;;0;;;;1;12;1;;;
837;4;70;an Umuchu Visitation Hospital;Rural;;0;;;;1;12;1;;;q3npGmpr7jB
838;4;70;an Umuona Ijeoma Hospital/Maternity;Rural;;0;;;;1;12;1;;;
839;4;70;an Umuona Primary Health Centre;Rural;;0;;;;1;12;1;;;
840;4;70;an Zenith Hospital and Maternity Ekwulobia;Rural;;0;;;;1;12;1;;;
841;4;71;an Abube Agu Nando Primary Health Centre;Rural;;0;;;;1;12;1;;;
842;4;71;an Eziagulu Out Primary Health Centre;Rural;;0;;;;1;12;1;;;
843;4;71;an Aguleri Immaculate Heart Hospital;Rural;;0;;;;1;12;1;;;gtLJZDkoOBJ
844;4;71;an Nsugbe Model Primary Health Care Centre;Rural;;0;;;;1;12;1;;;
845;4;71;an Umueri Diocesan Hospital and Maternity;Rural;;0;;;;1;12;1;;;cmzZbUX3cGw
846;4;72;an Inoma Primary Health Centre;Rural;;0;;;;1;12;1;;;
847;4;72;an Odeh Primary Health Centre;Rural;;0;;;;1;12;1;;;
848;4;72;an Oroma Etiti Referral Health Centre;Rural;;0;;;;1;12;1;;;
849;4;72;an Umudeze Mmiata Primary Health Centre;Rural;;0;;;;1;12;1;;;
850;4;72;an Umueze Anam Primary Health Centre;Rural;;0;;;;1;12;1;;;rnuQ07KLnnj
851;4;73;an Adazi Enu Primary Health Centre;Rural;;0;;;;1;12;1;;;
852;4;73;an Adazi St Joseph Hospital;Rural;;0;;;;1;12;1;;;RZZDd9hVjdr
853;4;73;an Agulu General Hospital;Rural;;0;;;;1;12;1;;;
854;4;73;an Agulu Ifeanyichukwu Hospital;Rural;;0;;;;1;12;1;;;
855;4;73;an Agulu Nkitaku Primary Health Centre;Rural;;0;;;;1;12;1;;;
856;4;73;an Agulu-Uzoigbo Health Centre;Rural;;0;;;;1;12;1;;;
857;4;90;an Awkuzu Primary Health Centre;Rural;;0;;;;1;12;1;;;NUBcuXbC1ph
858;4;73;an Community Reproductive Referral Health Centre Neni;Rural;;0;;;;1;12;1;;;
859;4;73;an Epheta Maternity Centre;Rural;;0;;;;1;12;1;;;
860;4;73;an neni 1 Primary Health Centre;Rural;;0;;;;1;12;1;;;
861;4;73;an Neni Comprehensive Health Centre NAUTH;Rural;;0;;;;1;12;1;;;dIdqPfyMCVJ
862;4;73;an Nne Ogidi Agulu Primary Health Centre;Rural;;0;;;;1;12;1;;;
863;4;73;an Nne Ogidi Agulu Primary Health Centre;Rural;;0;;;;1;12;1;;;
864;4;73;an Nri Primary Health Centre;Rural;;0;;;;1;12;1;;;
865;4;73;an Obeledu Primary Health Centre;Rural;;0;;;;1;12;1;;;
866;4;73;an Umunri Neni Primary Health Centre;Rural;;0;;;;1;12;1;;;
867;4;73;an Umuowelle Agulu Primary Health Centre;Rural;;0;;;;1;12;1;;;
868;4;74;an Achalla Primary Health Centre;Rural;;0;;;;1;12;1;;;
869;4;74;an Amanuke Primary Health Centre;Rural;;0;;;;1;12;1;;;
870;4;74;an Awba Offemmili Primary Health Centre;Rural;;0;;;;1;12;1;;;
871;4;74;an Isuniocha Primary Health Centre;Rural;;0;;;;1;12;1;;;
872;4;74;an Mgbakwu Primary Health Centre;Rural;;0;;;;1;12;1;;;
873;4;74;an Ugbenu Primary Health Centre;Rural;;0;;;;1;12;1;;;
874;4;74;an Urum Primary Health Centre;Rural;;0;;;;1;12;1;;;
875;4;75;an Amawbia Maternal and Child Health Clinic;Urban;;0;;;;1;12;1;;;
876;4;75;an Anambra State University Teaching Hospital;Urban;;0;;;;1;12;1;;;hJaxCbxFdLS
877;4;75;an Awka Faith Hospital;Urban;;0;;;;1;12;1;;;xkRlTJBZ79F
878;4;75;an Awka Harmony Hospital;Urban;;0;;;;1;12;1;;;
879;4;75;an Be GLAD Foundation;Rural;;0;;;;1;12;1;;;
880;4;75;an Beacon Hospital;Urban;;0;;;;1;12;1;;;
881;4;75;an Christ the King Hospital;Urban;;0;;;;1;12;1;;;
882;4;75;an Climax Specialist Hospital;Urban;;0;;;;1;12;1;;;
883;4;75;an Divine Hospital and Maternity Amikwo Awka;Urban;;0;;;;1;12;1;;;
884;4;75;an Everest Hospital and Maternity;Urban;;0;;;;1;12;1;;;
885;4;75;an God is able Maternity Home;Urban;;0;;;;1;12;1;;;qIjqxMKTc8E
886;4;75;an His Glory Hospital and Maternity;Urban;;0;;;;1;12;1;;;
887;4;75;an Ifebi Medical Centre;Urban;;0;;;;1;12;1;;;
888;4;75;an Ikechukwu Maternity Home;Rural;;0;;;;1;12;1;;;
889;4;75;an Izunna Hospital and Maternity;Urban;;0;;;;1;12;1;;;
890;4;75;an Miracle Maternity Home;Urban;;0;;;;1;12;1;;;
891;4;75;an Nibo Basic Health Center;Rural;;0;;;;1;12;1;;;
892;4;75;an Nkwelle Primary Health Centre;Rural;;0;;;;1;12;1;;;
893;4;75;an Nworahs Hospital;Urban;;0;;;;1;12;1;;;
894;4;75;an Obioma Hospital;Urban;;0;;;;1;12;1;;;
895;4;75;an Police Comprehensive Hospital Awka;Urban;;0;;;;1;12;1;;;
896;4;75;an Regina Caeli Hospital;Urban;;0;;;;1;12;1;;;vSs8HGhz2i9
897;4;75;an Rock Foundation Hospital;Urban;;0;;;;1;12;1;;;
898;4;75;an Sefton Specialist Hospital;Urban;;0;;;;1;12;1;;;
899;4;75;an Trinity Hospital and Maternity;Urban;;0;;;;1;12;1;;;OaDlk4Ffi9u
900;4;75;an Umuawulu Primary Health Centre;Urban;;0;;;;1;12;1;;;
901;4;76;an Amikwe Omor Health Post;Rural;;0;;;;1;12;1;;;
902;4;76;an Anaku Primary Health Centre;Rural;;0;;;;1;12;1;;;
903;4;76;an Ifite Ogwari Primary Health Centre;Rural;;0;;;;1;12;1;;;
904;4;76;an Ifite-Ogwari Amasi-Udala Primary Health Centre;Rural;;0;;;;1;12;1;;;
905;4;76;an Igbaku Health Post;Rural;;0;;;;1;12;1;;;
906;4;76;an Omasi-Agu Primary Health Centre;Rural;;0;;;;1;12;1;;;
907;4;76;an Omor Primary Health Centre;Rural;;0;;;;1;12;1;;;
908;4;77;an Akwa Ifitedunu Primary Health Centre;Rural;;0;;;;1;12;1;;;
909;4;77;an Ebelechukwu Maternal Home;Rural;;0;;;;1;12;1;;;
910;4;77;an Nkwelle Umunachi Primary Health Centre;Rural;;0;;;;1;12;1;;;
911;4;77;an Rural Women Foundation;Rural;;0;;;;1;12;1;;;
912;4;77;an Ukpo Comprehensive Health Centre;Rural;;0;;;;1;12;1;;;vXQYAhkWDFv
913;4;77;an Ukpo Primary Health Centre;Rural;;0;;;;1;12;1;;;
914;4;77;an Ukwulu Primary Health Centre;Rural;;0;;;;1;12;1;;;
915;4;77;an Umuanugwo Ifitedunu Primary Health Centre;Rural;;0;;;;1;12;1;;;
916;4;78;an Afor Ilo Primary Health Centre Ozubulu;Rural;;0;;;;1;12;1;;;
917;4;78;an Nza Primary Health Centre;Rural;;0;;;;1;12;1;;;
918;4;78;an Orafite General Hospital;Rural;;0;;;;1;12;1;;;S6BM5MjtOr6
919;4;78;an Ozubule Maternal and Child Health;Rural;;0;;;;1;12;1;;;
920;4;79;an Adinma Specialist Hospital and Maternity;Urban;;0;;;;1;12;1;;;
921;4;79;an Ark of Covenant Hospital;Urban;;0;;;;1;12;1;;;
922;4;79;an Awada Peace Hospital and Maternity;Urban;;0;;;;1;12;1;;;
923;4;79;an Chiagozie Maternity Home Oraukwu;Rural;;0;;;;1;12;1;;;
924;4;78;an Chinedum Hospital and Maternity Ozubulu;Rural;;0;;;;1;12;1;;;
925;4;79;an Chukwudi Hospital;Urban;;0;;;;1;12;1;;;
926;4;79;an Divine Mercy Hospital and Maternity;Urban;;0;;;;1;12;1;;;
927;4;79;an Eberechukwu Maternity Nkpor Uno;Rural;;0;;;;1;12;1;;;
928;4;79;an El-shaddai Hospital and Maternity;Urban;;0;;;;1;12;1;;;
929;4;79;an Emmanuel Obiakor Memorial Hospital Ogidi;Urban;;0;;;;1;12;1;;;
930;4;79;an Ezim Memorial Hospital Obosi;Urban;;0;;;;1;12;1;;;
931;4;78;an Eziora Primary Health Centre;Rural;;0;;;;1;12;1;;;
932;4;79;an Graceland Foundation Hospital and Maternity;Urban;;0;;;;1;12;1;;;
933;4;78;an Holy Family Hospital and Maternity;Rural;;0;;;;1;12;1;;;
934;4;78;an Ibollo Primary Health Centre;Rural;;0;;;;1;12;1;;;
935;4;78;an Ifite Primary Health Centre Oraifite;Rural;;0;;;;1;12;1;;;
936;4;79;an Immaculate Heart Hospital (Nkpor);Urban;;0;;;;1;12;1;;;qgqhqfcKGdq
937;4;79;an Iyi-Enu Hospital;Urban;;0;;;;1;12;1;;;DMSChigclvX
938;4;79;an Madueke Memorial Hospital and Maternity;Urban;;0;;;;1;12;1;;;UWquziI5Peu
939;4;79;an Ndubisi Clinic;Rural;;0;;;;1;12;1;;;
940;4;79;an New Mayor Hospital and Fertility Centre;Urban;;0;;;;1;12;1;;;
941;4;79;an Nkpor Chukwunonso Hospital and Maternity;Urban;;0;;;;1;12;1;;;
942;4;79;an Nkpor Crown Hospital & Maternity;Urban;;0;;;;1;12;1;;;iS2evJ9w5Os
943;4;79;an Nkpor First Line Specialist Hospital and Maternity;Urban;;0;;;;1;12;1;;;
944;4;79;an Nkpor Hossan Hospital;Urban;;0;;;;1;12;1;;;
945;4;79;an Nkpor Ndu Primary Health Centre;Urban;;0;;;;1;12;1;;;
946;4;79;an Nkpor St. Dominic Hospital and Maternity;Urban;;0;;;;1;12;1;;;
947;4;79;an Nobel Hospital and Maternity;Urban;;0;;;;1;12;1;;;
948;4;79;an Nwabume Memorial Maternity Umuotu Obosi;Rural;;0;;;;1;12;1;;;
949;4;79;an Obinwane Hospital and Maternity;Urban;;0;;;;1;12;1;;;
950;4;79;an Obosi St Martins Hospital;Urban;;0;;;;1;12;1;;;ChKm6shbRNJ
951;4;79;an Ogbu Abatete Primary Health Centre;Rural;;0;;;;1;12;1;;;
952;4;79;an Ogidi General Hospital;Urban;;0;;;;1;12;1;;;
953;4;79;an Ogidi Maternal and Child Health Clinic;Urban;;0;;;;1;12;1;;;
954;4;78;an Ositadinma Hospital and Maternity;Rural;;0;;;;1;12;1;;;
955;4;79;an Queen of Babies Maternity Home Nkpor;Urban;;0;;;;1;12;1;;;
956;4;78;an Referral Health Centre Oraifite;Rural;;0;;;;1;12;1;;;
957;4;79;an St Josephs Maternity Home Umuoji;Rural;;0;;;;1;12;1;;;
958;4;75;an St Michaels Hospital/Maternity;Urban;;0;;;;1;12;1;;;
959;4;79;an Three Sister Maternity Home;Urban;;0;;;;1;12;1;;;
960;4;79;an Umuoji St. Rita Maternity Home;Rural;;0;;;;1;12;1;;;
961;4;80;an Alor Primary Health Centre;Rural;;0;;;;1;12;1;;;
962;4;80;an Awka-Etiti Primary Health Centre;Rural;;0;;;;1;12;1;;;
963;4;80;an Awuda Nnobi Primary Health Centre;Rural;;0;;;;1;12;1;;;
964;4;80;an Chiamaka Hospital and Maternity Nnobi;Rural;;0;;;;1;12;1;;;
965;4;80;an Ebenesi Nnobi Primary Health Centre;Rural;;0;;;;1;12;1;;;ZV1Fk6gIXJz
966;4;80;an Moon Hospital;Rural;;0;;;;1;12;1;;;
967;4;80;an Nnobi Chukwunonso Hospital & Maternity;Urban;;0;;;;1;12;1;;;hpy0psIMqSV
968;4;80;an Nnobi General Hospital;Rural;;0;;;;1;12;1;;;
969;4;80;an Nnokwa Primary Health Centre;Rural;;0;;;;1;12;1;;;
970;4;80;an Oba Comprehensive Health Centre (Trauma Centre);Rural;;0;;;;1;12;1;;;mS9v4wYl05U
971;4;80;an Ojoto-Obofia Primary Health Centre;Rural;;0;;;;1;12;1;;;T6Wx5UabHht
972;4;80;an Ojotu Uno Primary Health Centre;Rural;;0;;;;1;12;1;;;qvt6oTQ7By7
973;4;80;an Our Lady of Fatima Catholic Hospital;Rural;;0;;;;1;12;1;;;
974;4;80;an Umuanocha Primary Health Centre;Rural;;0;;;;1;12;1;;;
975;4;81;an Amamputu Primary Health Centre;Rural;;0;;;;1;12;1;;;
976;4;81;an Azia Primary Health Centre;Rural;;0;;;;1;12;1;;;
977;4;81;an Eziama Uli Primary Health Centre;Rural;;0;;;;1;12;1;;;
978;4;81;an Eziani Health Centre;Rural;;0;;;;1;12;1;;;Ilr05AToeXm
979;4;81;an Iseke Primary Health Centre;Rural;;0;;;;1;12;1;;;
980;4;81;an Mbosi Primary Health Centre;Rural;;0;;;;1;12;1;;;
981;4;81;an Okija General Hospital;Rural;;0;;;;1;12;1;;;
982;4;81;an Okija Primary Health Centre;Rural;;0;;;;1;12;1;;;
983;4;81;an Orsumoghu Primary Health Centre;Rural;;0;;;;1;12;1;;;
984;4;81;an Our Lady of Lourdes Hospital;Urban;;0;;;;1;12;1;;;QxjGLYSI8JF
985;4;78;an Ozubulu St. Jude Hospital and Maternity;Rural;;0;;;;1;12;1;;;lg153HStqaI
986;4;81;an Uli Primary Health Centre;Rural;;0;;;;1;12;1;;;
987;4;81;an Umuatuegwu Okija Primary Health Centre;Rural;;0;;;;1;12;1;;;
988;4;81;an Umudara Primary Health Centre;Rural;;0;;;;1;12;1;;;
989;4;81;an Umuhu Ubahu Okija Primary Health Centre;Rural;;0;;;;1;12;1;;;NnnDeW7KPHH
990;4;81;an Umuohi Primary Health Centre;Rural;;0;;;;1;12;1;;;
991;4;81;an Vera Clinic Ihiala;Rural;;0;;;;1;12;1;;;
992;4;82;an Abagana Health Centre;Rural;;0;;;;1;12;1;;;
993;4;82;an Abba Primary Health Centre;Rural;;0;;;;1;12;1;;;
994;4;82;an Adegbe Avonimi Primary Health Centre;Rural;;0;;;;1;12;1;;;
995;4;82;an Beke Memorial Hospital Nimo;Rural;;0;;;;1;12;1;;;
996;4;82;an BeluChukwu Hospital and Maternity;Rural;;0;;;;1;12;1;;;
997;4;82;an Egbengwu Nimo Primary Health Centre;Rural;;0;;;;1;12;1;;;
998;4;82;an Enugu Agidi Primary Health Centre;Rural;;0;;;;1;12;1;;;
999;4;82;an Eziomaigbo Primary Health Centre;Rural;;0;;;;1;12;1;;;
1000;4;82;an Nawfia Primary Health Centre;Rural;;0;;;;1;12;1;;;
1001;4;82;an Nimo General Hospital;Rural;;0;;;;1;12;1;;;
1002;4;82;an Okpala Hospital and Maternity Enugu Ukwu;Rural;;0;;;;1;12;1;;;
1003;4;82;an St. Ann Hospital and Maternity;Rural;;0;;;;1;12;1;;;
1004;4;82;an Umudiaba Nimo Primary Health Centre;Rural;;0;;;;1;12;1;;;
1005;4;82;an Urban Hospital and Maternity Abagana;Rural;;0;;;;1;12;1;;;
1006;4;82;an Urunnebo Enugwu Ukwu Primary Health Centre;Rural;;0;;;;1;12;1;;;
1007;4;82;an Uruogbo Enugwu Ukwu Primary Health Centre;Rural;;0;;;;1;12;1;;;
1008;4;83;an Abubor Nnewichi Chimex Hospital and Maternity;Urban;;0;;;;1;12;1;;;
1009;4;83;an Abubor Nnewichi Obioma Specialist Hospital;Urban;;0;;;;1;12;1;;;zhRuexFZvIb
1010;4;83;an ADONHACDC;Urban;;0;;;;1;12;1;;;
1011;4;83;an De Dominion Hospital and Maternity Uruagu;Urban;;0;;;;1;12;1;;;
1012;4;83;an Edoji Primary Health Centre;Rural;;0;;;;1;12;1;;;
1013;4;83;an Emecourt Health Centre Nnewi;Rural;;0;;;;1;12;1;;;
1014;4;83;an First Maf Hospital and Maternity Nnewi;Urban;;0;;;;1;12;1;;;
1015;4;83;an Glory Hospital and Maternity;Rural;;0;;;;1;12;1;;;
1016;4;83;an Holy Trinity Hospital and Maternity;Rural;;0;;;;1;12;1;;;
1017;4;83;an Inyaba Health Centre  Nnewi;Rural;;0;;;;1;12;1;;;
1018;4;83;an Ndiakwu Health Centre Otolo Nnewi;Rural;;0;;;;1;12;1;;;
1019;4;83;an Ngozi Chukwuka Hospital and Maternity;Rural;;0;;;;1;12;1;;;
1020;4;83;an Nnamdi Azikiwe University Teaching Hospital;Urban;;0;;;;1;12;1;;;cHx0SynlcSV
1021;4;83;an Nnewi Diocesan Hospital;Urban;;0;;;;1;12;1;;;aaLlTiXCFJX
1022;4;83;an Nnewi Okpuno-Otolo Health Centre;Urban;;0;;;;1;12;1;;;
1023;4;83;an Nnewi Udeagbala Foundation Hospital and Maternity;Urban;;0;;;;1;12;1;;;
1024;4;83;an Okpuno Egbu Primary Health Centre;Rural;;0;;;;1;12;1;;;
1025;4;83;an Okpunor Nnewichi Rose of Sharon Specialist Hospital;Urban;;0;;;;1;12;1;;;
1026;4;83;an Okwuani Immaculate Heart Hospital and Maternity;Urban;;0;;;;1;12;1;;;
1027;4;83;an Otolo Ikedife Specialist Hospital;Urban;;0;;;;1;12;1;;;
1028;4;83;an Otolo Nnewi Chidiera Hospital;Urban;;0;;;;1;12;1;;;h1Gwe05xHF3
1029;4;83;an Otolo Umuenem Primary Health Centre;Urban;;0;;;;1;12;1;;;wPTAa1ma3wy
1030;4;83;an Umudim Chicason Hospital;Urban;;0;;;;1;12;1;;;
1031;4;83;an Umudim Life Specialist Hospital and Maternity;Urban;;0;;;;1;12;1;;;DFvpdmmZW7r
1032;4;83;an Zenith Hospital and Maternity;Urban;;0;;;;1;12;1;;;N23HBtM1xn9
1033;4;84;an St. Lukes Hospital Annex Ukpor;Rural;;0;;;;1;12;1;;;
1034;4;84;an Amichi Diocesan Hospital;Rural;;0;;;;1;12;1;;;IIXdhByG6KB
1035;4;84;an Amichi Primary Health Centre;Rural;;0;;;;1;12;1;;;
1036;4;84;an Ekwulumili Maternity Home;Rural;;0;;;;1;12;1;;;
1037;4;84;an Ekwulumili Primary Health Centre;Rural;;0;;;;1;12;1;;;
1038;4;84;an Osumenyi Comprehensive Health Centre;Rural;;0;;;;1;12;1;;;
1039;4;84;an Osumenyi Visitation Hospital;Rural;;0;;;;1;12;1;;;wjxuSn1nNXt
1040;4;84;an Utu Maternity Home (PHC Utu);Rural;;0;;;;1;12;1;;;
1041;4;85;an Akili Ogidi Primary Health Centre;Rural;;0;;;;1;12;1;;;
1042;4;85;an Atani Comprehensive Health Centre;Urban;;0;;;;1;12;1;;;
1043;4;85;an Ave Maria Hospital and Maternity Home;Rural;;0;;;;1;12;1;;;
1044;4;85;an Beautiful Gate Hospital Atani Road Odekpe;Urban;;0;;;;1;12;1;;;
1045;4;85;an Chidi Maternity;Rural;;0;;;;1;12;1;;;
1046;4;85;an Chukwubuike Maternity Home Okpoko;Urban;;0;;;;1;12;1;;;
1047;4;85;an Edmunds Specialist Hospital;Rural;;0;;;;1;12;1;;;
1048;4;85;an Goodnews Hospital and Maternity;Rural;;0;;;;1;12;1;;;HSTf9UcNBJl
1049;4;85;an Holy Child Maternity and Clinic;Rural;;0;;;;1;12;1;;;
1050;4;85;an Ijeoma Maternity Home;Rural;;0;;;;1;12;1;;;
1051;4;85;an Iyiowa Odekpe Model Hospital and Maternity;Rural;;0;;;;1;12;1;;;
1052;4;85;an Iyiowa Odekpe New Life Hospital and Maternity;Rural;;0;;;;1;12;1;;;
1053;4;85;an Kelechi Hospital and Maternity;Urban;;0;;;;1;12;1;;;
1054;4;85;an Lumen Christ Hospital;Rural;;0;;;;1;12;1;;;
1055;4;85;an Mother of Mercy Maternity Home;Rural;;0;;;;1;12;1;;;
1056;4;85;an Multicare Hospital and Women Welfare Centre;Rural;;0;;;;1;12;1;;;
1057;4;85;an New Life Hospital and Maternity Atani Road;Urban;;0;;;;1;12;1;;;
1058;4;85;an Njideka Hospital and Maternity Home Okpoko;Urban;;0;;;;1;12;1;;;
1059;4;85;an Nkpikpa Obosi Divine Care Clinic and Maternity;Rural;;0;;;;1;12;1;;;
1060;4;85;an Nnedimma Hospital and Maternity;Urban;;0;;;;1;12;1;;;
1061;4;85;an Nwobi Memorial Hospital;Rural;;0;;;;1;12;1;;;Cnb5lGJlrb1
1062;4;85;an Nzubechukwu Maternity and Clinic;Urban;;0;;;;1;12;1;;;
1063;4;85;an Ochuche Model Primary Health Centre;Rural;;0;;;;1;12;1;;;
1064;4;85;an Ogbakuba Primary Health Centre;Rural;;0;;;;1;12;1;;;
1065;4;85;an Ogwuanaocha Basic Health Centre;Rural;;0;;;;1;12;1;;;
1066;4;85;an Okpoko All Saints Maternity;Rural;;0;;;;1;12;1;;;
1067;4;85;an Okpoko Bethel Hospital and Maternity;Rural;;0;;;;1;12;1;;;
1068;4;85;an Okpoko Ebenezar Hospital and Maternity;Rural;;0;;;;1;12;1;;;
1069;4;85;an Okpoko Gods Will Hospital and Maternity;Rural;;0;;;;1;12;1;;;
1070;4;85;an Okpoko Kings Kidd Hospital and Maternity;Rural;;0;;;;1;12;1;;;VsHKymoen6e
1071;4;85;an Okpoko Living Spring Hospital and Maternity and Children Welfare Centre;Rural;;0;;;;1;12;1;;;
1072;4;85;an Okpoko St Lukes Diocesan Hospital;Rural;;0;;;;1;12;1;;;VH4JhFc5gHb
1073;4;85;an Onyinyechukwu Maternity;Rural;;0;;;;1;12;1;;;
1074;4;85;an Orient Hospital and Maternity;Rural;;0;;;;1;12;1;;;
1075;4;85;an Ossomala Primary Health Centre;Rural;;0;;;;1;12;1;;;
1076;4;85;an Our Mother of Perpetual Help Maternity;Rural;;0;;;;1;12;1;;;
1077;4;85;an Patricia Memorial Hospital and Maternity Aka baby;Urban;;0;;;;1;12;1;;;A5Mfq0M4fNk
1078;4;85;an Remedy-Bay Maternity and Hospital;Rural;;0;;;;1;12;1;;;
1079;4;85;an Somtoochukwu Maternity Clinic;Rural;;0;;;;1;12;1;;;
1080;4;85;an Uchechukwu Maternity Odekpe;Urban;;0;;;;1;12;1;;;
1081;4;85;an Umunankwo Primary Health Centre Ogbaru;Rural;;0;;;;1;12;1;;;
1082;4;86;an Akpaka Primary Health Centre;Urban;;0;;;;1;12;1;;;
1083;4;86;an All Hallows Hospital and Maternity;Urban;;0;;;;1;12;1;;;
1084;4;86;an Arinzechukwu Hospital and Childrens Clinic;Urban;;0;;;;1;12;1;;;
1085;4;86;an Azokwu Memorial Specialist Hospital and Maternity;Urban;;0;;;;1;12;1;;;
1086;4;86;an Blessed Specialist Hospital and Maternity;Urban;;0;;;;1;12;1;;;
1087;4;86;an Christ Church Health Post;Urban;;0;;;;1;12;1;;;
1088;4;86;an Glory Hospital Mat Complex;Urban;;0;;;;1;12;1;;;
1089;4;86;an Holy Rosary Hospital;Urban;;0;;;;1;12;1;;;ooKehfMNClN
1090;4;86;an HU PACE Anambra State Community Pharmacist;Urban;;0;;;;1;12;1;;;
1091;4;86;an Immanuel Church Primary Health Centre;Urban;;0;;;;1;12;1;;;
1092;4;86;an Inland town Primary Health Centre;Urban;;0;;;;1;12;1;;;
1093;4;86;an Isiafor Ascension Church Health Centre;Urban;;0;;;;1;12;1;;;
1094;4;86;an Ivy Foundation Hospital and Maternity;Urban;;0;;;;1;12;1;;;
1095;4;86;an Kanayo Specialist Hospital and Maternity;Urban;;0;;;;1;12;1;;;
1096;4;86;an Mainland Hospital and Maternity;Urban;;0;;;;1;12;1;;;
1097;4;86;an Marine Prison Health Post;Urban;;0;;;;1;12;1;;;
1098;4;86;an Multicare Hospital and Maternity;Urban;;0;;;;1;12;1;;;
1099;4;86;an Ndubuisi Hospital and Maternity;Urban;;0;;;;1;12;1;;;
1100;4;86;an Onitsha Basic Primary Health Centre;Urban;;0;;;;1;12;1;;;aB6ULpRYyMX
1101;4;86;an Onitsha Mezie Hospital & Maternity;Urban;;0;;;;1;12;1;;;
1102;4;86;an Onitsha St. Leo Hospital and Maternity;Urban;;0;;;;1;12;1;;;
1103;4;86;an Oscon Specialist Hospital and Maternity;Urban;;0;;;;1;12;1;;;
1104;4;86;an Pioneer International and Maternity;Urban;;0;;;;1;12;1;;;
1105;4;86;an Praises Health Care & Madam Denco Clinic;Urban;;0;;;;1;12;1;;;O25753qyKJk
1106;4;86;an Rapha Hospital and Maternity;Urban;;0;;;;1;12;1;;;
1107;4;86;an Shalom Foundation Specialist Hospital and Maternity;Urban;;0;;;;1;12;1;;;
1108;4;86;an St Charles Borromeo Hospital;Urban;;0;;;;1;12;1;;;psDtuBN3cg4
1109;4;86;an St. Barths Model Hospital & Maternity;Urban;;0;;;;1;12;1;;;
1110;4;86;an St. Luke Hospital;Urban;;0;;;;1;12;1;;;
1111;4;86;an St. Patricks Hospital and Maternity;Urban;;0;;;;1;12;1;;;
1112;4;86;an The Lords Glory Hospital & Maternity;Urban;;0;;;;1;12;1;;;
1113;4;86;an Venik Specialist Hospital and Maternity;Rural;;0;;;;1;12;1;;;
1114;4;86;an Winners Hospital and Maternity;Urban;;0;;;;1;12;1;;;
1115;4;87;an Benedicts Memorial Hospital and Maternity;Urban;;0;;;;1;12;1;;;
1116;4;87;an Bethsaida Specialist Hospital and Maternal;Urban;;0;;;;1;12;1;;;
1117;4;87;an Delta Hospital and Maternity;Urban;;0;;;;1;12;1;;;cqMmWA7Iwi7
1118;4;87;an Dibiaezue Hospital and Maternity;Urban;;0;;;;1;12;1;;;
1119;4;87;an Glory Hospital;Urban;;0;;;;1;12;1;;;
1120;4;87;an Gods EState Specialist Hospital and Maternity;Urban;;0;;;;1;12;1;;;
1121;4;87;an Menax Hospital and Maternity;Urban;;0;;;;1;12;1;;;
1122;4;87;an Mezie Hospital Alor;Rural;;0;;;;1;12;1;;;
1123;4;87;an Odoakpu Model Primary Health Centre;Urban;;0;;;;1;12;1;;;
1124;4;87;an Onitsha CEO Clinic and Maternity;Urban;;0;;;;1;12;1;;;
1125;4;87;an St Cyprians Hospital and Maternity;Urban;;0;;;;1;12;1;;;
1126;4;87;an Toronto Hospital Onitsha;Urban;;0;;;;1;12;1;;;
1127;4;88;an Afoudo Nanka Primary Health Centre;Rural;;0;;;;1;12;1;;;
1128;4;88;an Best Hospital and Maternity Oko;Rural;;0;;;;1;12;1;;;
1129;4;88;an Chioma Maternity Hospital Nanka;Rural;;0;;;;1;12;1;;;
1130;4;88;an Nanka Chukwunonso Hospital and Maternity;Rural;;0;;;;1;12;1;;;
1131;4;88;an Ndiowu Model Primary Health Centre;Rural;;0;;;;1;12;1;;;
1132;4;88;an Ndiowu Primary Health Centre;Rural;;0;;;;1;12;1;;;
1133;4;88;an Ofu-Obi Comprehensive Health Centre Agbiligba;Rural;;0;;;;1;12;1;;;
1134;4;88;an Oko Chukwunonso Hospital and Maternity;Rural;;0;;;;1;12;1;;;
1135;4;88;an Oko Community Hospital;Rural;;0;;;;1;12;1;;;CEv6guQORcN
1136;4;88;an Omogho Primary Health Centre;Rural;;0;;;;1;12;1;;;
1137;4;88;an Orumba General Hospital;Rural;;0;;;;1;12;1;;;
1138;4;88;an Referral Health Centre;Rural;;0;;;;1;12;1;;;
1139;4;88;an Referral Health Centre Awa;Rural;;0;;;;1;12;1;;;
1140;4;89;an Ezira Primary Health Centre;Rural;;0;;;;1;12;1;;;
1141;4;72;an Mmiata Anam Primary Health Centre;Rural;;0;;;;1;12;1;;;
1142;4;89;an Ogbunka Primary Health Centre;Rural;;0;;;;1;12;1;;;
1143;4;89;an Owerre Ezukala I Primary Health Centre;Rural;;0;;;;1;12;1;;;
1144;4;89;an Umunze Comprehensive Health Centre;Rural;;0;;;;1;12;1;;;
1145;4;89;an Umunze Immaculate Heart Hospital;Rural;;0;;;;1;12;1;;;pMMEGmLUAAf
1146;4;89;an Umunze St. Catherine Hospital;Rural;;0;;;;1;12;1;;;
1147;4;89;an Umuommaku Primary Health Centre;Rural;;0;;;;1;12;1;;;
1148;4;90;an Beatrice Hospital and Eye Centre Umunya;Rural;;0;;;;1;12;1;;;
1149;4;76;an Faith Clinic Omor;Rural;;0;;;;1;12;1;;;
1150;4;90;an Isaac Chira Memorial Hospital;Rural;;0;;;;1;12;1;;;
1151;4;90;an Ndibinaju Primary Health Centre;Rural;;0;;;;1;12;1;;;
1152;4;90;an Nkwelle-Ezunaka Health Centre;Rural;;0;;;;1;12;1;;;
1153;4;90;an Nteje Primary Health Centre;Rural;;0;;;;1;12;1;;;
1154;4;90;an Ogbunike Primary Health Centre;Rural;;0;;;;1;12;1;;;
1155;4;90;an Oze Nkwelle Ezunaka Primary Health Centre;Rural;;0;;;;1;12;1;;;
1156;4;90;an Umunya Comprehensive Health Centre;Rural;;0;;;;1;12;1;;;hBsMMfezJYL
1157;4;90;an Umunya Primary Health Centre;Rural;;0;;;;1;12;1;;;
1158;4;76;an Zodiac Medical Centre;Rural;;0;;;;1;12;1;;;
1159;5;92;ba Abubakar Tafawa Balewa University Teaching Hospital;Urban;;0;;;;1;12;1;;;BHkRzQsQgSl
1160;5;92;ba Al Amin Hospital;Urban;;0;;;;1;12;1;;;
1161;5;92;ba Apple Clinic;Urban;;0;;;;1;12;1;;;MpmpfU1fB1W
1162;5;92;ba Bayara Infectious Diseases Hospital;Urban;;0;;;;1;12;1;;;ExiHYOsNk3q
1163;5;92;ba City Clinic;Urban;;0;;;;1;12;1;;;
1164;5;92;ba Federal Low Cost Primary Health Centre;Urban;;0;;;;1;12;1;;;
1165;5;92;ba Forward in Action for Education; Poverty and Malnutrition;Urban;0;;;;0;1;12;1;;
1166;5;92;ba Kofar Wase Primary Health Centre;Urban;;0;;;;1;12;1;;;
1167;5;92;ba Mararraba Primary Health Centre;Rural;;0;;;;1;12;1;;;e1wNZo2KVzh
1168;5;92;ba MRS 33 Shadawanka;Urban;;0;;;;1;12;1;;;
1169;5;92;ba MRS School of Armor;Urban;;0;;;;1;12;1;;;
1170;5;92;ba Nassarawa Jahun Primary Health Centre;Urban;;0;;;;1;12;1;;;
1171;5;92;ba Ni ima Consultant;Urban;;0;;;;1;12;1;;;Kw2RkNdIiXq
1172;5;92;ba Pohlycon Clinic;Urban;;0;;;;1;12;1;;;psgTbmKsVCn
1173;5;92;ba Reemee Clinic;Urban;;0;;;;1;12;1;;;f6kjRzEuJzu
1174;5;92;ba State Low Cost Primary Health Centre;Urban;;0;;;;1;12;1;;;bQStBgfeo52
1175;5;92;ba Tirwun Maternal and Child Health Clinic;Urban;;0;;;;1;12;1;;;
1176;5;92;ba Under 5 Primary Health Centre;Urban;;0;;;;1;12;1;;;
1177;5;92;ba Urban Maternity;Urban;;0;;;;1;12;1;;;bT2ZyZLk44k
1178;5;92;ba Women Empowerment Initiative;Urban;;0;;;;1;12;1;;;
1179;5;92;ba Wuntin Dada Maternal and Child Health Clinic;Urban;;0;;;;1;12;1;;;LH4mky1erCW
1180;5;92;baYalwan Kagadama Primary Health Centre;Urban;;0;;;;1;12;1;;;bBX8D3olX8U
1181;5;93;ba Bogoro General Hospital;Rural;;0;;;;1;12;1;;;Xz63xHPUIiS
1182;5;93;ba Bogoro Maternal & Child Health Clinic;Rural;;0;;;;1;12;1;;;LuEdSlvCNqy
1183;5;96;ba Dass General Hospital;Rural;;0;;;;1;12;1;;;TmGBqInZVhq
1184;5;98;ba Dabe Primary Health Centre;Rural;;0;;;;1;12;1;;;
1185;5;98;ba Kafin Madaki General Hospital;Rural;;0;;;;1;12;1;;;OcFekRBRw8K
