facility_id;state_id;lga_id;name;facility_type;address1;address2;phone1;phone2;email;pad_hospital_num;day_dqa;active;partner_ids;national_id;datim_id
1984;20;377;Kn Mahuta Dalal Clinic;Rural;;0;;;;1;12;1;;;
1985;20;377;kn Massalanchi Health Centre;Rural;;0;;;;1;12;1;;;
1986;20;377;kn San-San Primary Health Centre;Rural;;0;;;;1;12;1;;;
1987;20;377;kn Shiddar Health Post;Rural;;0;;;;1;12;1;;;
1988;20;378;kn Dawakiji Basic Health Clinic;Rural;;0;;;;1;12;1;;;
1989;20;378;kn Dawakin Kudu General Hospital;Urban;;0;;;;1;12;1;;;OYIdJmk5zld
1990;20;378;kn Dosan Health Centre;Rural;;0;;;;1;12;1;;;
1991;20;378;kn Fanchin Dispensary;Rural;;0;;;;1;12;1;;;
1992;20;378;kn Gada Primary Health Centre;Rural;;0;;;;1;12;1;;;
1993;20;378;kn Gano Primary Health Centre;Rural;;0;;;;1;12;1;;;
1994;20;378;kn Gurjiya Health Post;Rural;;0;;;;1;12;1;;;
1995;20;378;kn Jido Dispensary;Rural;;0;;;;1;12;1;;;
1996;20;378;kn Matage Dispensary;Rural;;0;;;;1;12;1;;;
1997;20;378;kn Tamburawa Health Post;Rural;;0;;;;1;12;1;;;
1998;20;378;kn Tsakuwa Basic Health Post;Rural;;0;;;;1;12;1;;;
1999;20;378;kn Yankatsari Primary Health Centre;Rural;;0;;;;1;12;1;;;
2000;20;378;kn Zogarawa Primary Health Centre;Rural;;0;;;;1;12;1;;;
2001;20;379;kn Chedi Babbar Ruga Primary Health Centre;Rural;;0;;;;1;12;1;;;
2002;20;379;kn Danguguwa Primary Health Centre;Rural;;0;;;;1;12;1;;;
2003;20;379;kn Dawakin Tofa General Hospital;Urban;;0;;;;1;12;1;;;kUtyn0U4Zl4
2004;20;379;kn Dawanau Primary Health Centre;Rural;;0;;;;1;12;1;;;
2005;20;379;kn Fango Health Post;Rural;;0;;;;1;12;1;;;
2006;20;379;kn Gundutse Primary Health Centre;Rural;;0;;;;1;12;1;;;
2007;20;379;kn Kadawa Dispensary (DTF);Rural;;0;;;;1;12;1;;;
2008;20;379;kn Kunawa Health Post;Rural;;0;;;;1;12;1;;;
2009;20;379;kn Kwa Primary Health Centre;Rural;;0;;;;1;12;1;;;
2010;20;379;kn Madachi Dispensary;Rural;;0;;;;1;12;1;;;
2011;20;379;kn Marke Dispensary;Rural;;0;;;;1;12;1;;;
2012;20;379;kn Tattarawa Primary Health Centre;Rural;;0;;;;1;12;1;;;
2013;20;379;kn Tunfafi Health Facility;Rural;;0;;;;1;12;1;;;
2014;20;379;kn Yakasai Health Facility;Rural;;0;;;;1;12;1;;;
2015;20;379;kn Yarrutu Health Post;Rural;;0;;;;1;12;1;;;
2016;20;379;kn Zango Dawanau Health Clinic;Rural;;0;;;;1;12;1;;;
2017;20;380;kn Asada Health Post;Rural;;0;;;;1;12;1;;;
2018;20;380;kn Burji Comprehensive Health Centre;Rural;;0;;;;1;12;1;;;
2019;20;380;kn Dadin-Kowa Primary Health Centre;Rural;;0;;;;1;12;1;;;
2020;20;380;kn Dariyar Shere Health Post;Rural;;0;;;;1;12;1;;;
2021;20;380;kn Doguwa General Hospital;Urban;;0;;;;1;12;1;;;KrsNTx44G1I
2022;20;380;kn Falgore Primary Health Centre;Rural;;0;;;;1;12;1;;;
2023;20;380;kn Maraku Primary Health Centre;Rural;;0;;;;1;12;1;;;
2024;20;380;kn Riruwai Basic Health Centre;Rural;;0;;;;1;12;1;;;
2025;20;380;kn Rufai Health Post;Rural;;0;;;;1;12;1;;;
2026;20;380;kn Unguwar Natsohuwa Health Post;Rural;;0;;;;1;12;1;;;
2027;20;380;kn Zainabi Dispensary;Rural;;0;;;;1;12;1;;;
2028;20;381;kn Alpha Clinic & Maternity;Urban;;0;;;;1;12;1;;;
2029;20;381;kn Amina Specialist Hospital;Urban;;0;;;;1;12;1;;;
2030;20;381;kn Barewa Clinic;Urban;;0;;;;1;12;1;;;
2031;20;381;kn Continental Clinic (Sabon Gari East);Urban;;0;;;;1;12;1;;;
2032;20;381;kn Cordial Hospital & Maternity;Urban;;0;;;;1;12;1;;;
2033;20;381;kn Dan Rimi Health Centre;Urban;;0;;;;1;12;1;;;
2034;20;381;kn Galadima Health Clinic;Urban;;0;;;;1;12;1;;;
2035;20;381;kn Hajaratu Tudun Bojuwa Health Centre;Urban;;0;;;;1;12;1;;;
2036;20;381;kn International Clinic;Urban;;0;;;;1;12;1;;;jLRtj3a2Tt2
2037;20;381;kn Jaba Primary Health Centre;Urban;;0;;;;1;12;1;;;
2038;20;381;kn Kano Infectious Diseases Hospital;Urban;;0;;;;1;12;1;;;o7hgxd8M2UG
2039;20;381;kn Khadijat Memorial Hospital (FGE);Urban;;0;;;;1;12;1;;;A30KxirCAp2
2040;20;381;kn Kunya Hospital;Urban;;0;;;;1;12;1;;;
2041;20;381;kn Kwachiri Primary Health Centre;Urban;;0;;;;1;12;1;;;
2042;20;381;kn Lafiya Surgery;Urban;;0;;;;1;12;1;;;
2043;20;381;kn Middle Road Maternity and Child Health;Urban;;0;;;;1;12;1;;;
2044;20;381;kn Modular Clinic;Urban;;0;;;;1;12;1;;;
2045;20;381;kn Nakowa Clinic;Urban;;0;;;;1;12;1;;;
2046;20;381;kn Rijiyar Lemo Maternal Child Health;Urban;;0;;;;1;12;1;;;XsH3pb5MppK
2047;20;381;kn Rijiyar Lemo Primary Health Centre;Urban;;0;;;;1;12;1;;;
2048;20;381;kn Sabo Garba Maternal and Child Health Centre;Urban;;0;;;;1;12;1;;;
2049;20;381;kn Sheikh Mohammed Jidda General Hospital;Urban;;0;;;;1;12;1;;;gKQbBiMDnKy
2050;20;381;kn Sumar Specialist Clinic;Urban;;0;;;;1;12;1;;;
2051;20;381;kn Universal Clinic and Maternity;Urban;;0;;;;1;12;1;;;
2052;20;381;kn Yanmata Gabbas Health Post;Urban;;0;;;;1;12;1;;;
2053;20;381;kn Zoputa (Assumpta) Clinic;Urban;;0;;;;1;12;1;;;
2054;20;383;kn AHIP Primary Health Centre;Rural;;0;;;;1;12;1;;;
2055;20;383;kn Buda Primary Health Centre;Rural;;0;;;;1;12;1;;;
2056;20;383;kn Dal Primary Health Centre;Rural;;0;;;;1;12;1;;;
2057;20;383;kn Garin Ali Primary Health Centre;Rural;;0;;;;1;12;1;;;
2058;20;383;kn Garko Model Primary Health Centre;Rural;;0;;;;1;12;1;;;
2059;20;383;kn Garko Primary Health Centre;Rural;;0;;;;1;12;1;;;
2060;20;383;kn Gurji Primary Health Centre;Rural;;0;;;;1;12;1;;;
2061;20;383;kn Kafin-Chiri Primary Health Centre;Rural;;0;;;;1;12;1;;;
2062;20;383;kn Kafin-Malamai Primary Health Centre;Rural;;0;;;;1;12;1;;;
2063;20;383;kn Kwas Health Post;Rural;;0;;;;1;12;1;;;
2064;20;383;kn Lamire Health Post;Rural;;0;;;;1;12;1;;;
2065;20;383;kn Maida Primary Health Centre;Rural;;0;;;;1;12;1;;;
2066;20;383;kn Sanni Health Post;Rural;;0;;;;1;12;1;;;
2067;20;383;kn Sarina Primary Health Centre;Rural;;0;;;;1;12;1;;;
2068;20;383;kn Tsakuwa Dal Health Post;Rural;;0;;;;1;12;1;;;
2069;20;383;kn Zakarawa Dispensary;Rural;;0;;;;1;12;1;;;
2070;20;384;kn Ciromawa Health Post;Rural;;0;;;;1;12;1;;;
2071;20;384;kn Dakasoye Health Post;Rural;;0;;;;1;12;1;;;
2072;20;384;kn Garun Babba Basic Health Centre;Rural;;0;;;;1;12;1;;;
2073;20;384;kn Garun Malam Basic Health Clinic;Rural;;0;;;;1;12;1;;;
2074;20;384;kn Kadawa Gate Basic Health Centre;Rural;;0;;;;1;12;1;;;
2075;20;384;kn Kadawa Primary Health Centre;Rural;;0;;;;1;12;1;;;
2076;20;384;kn Makoro Health Post;Rural;;0;;;;1;12;1;;;
2077;20;384;kn Mudawa Health Post;Rural;;0;;;;1;12;1;;;
2078;20;384;kn Yadakwari Basic Health Centre;Rural;;0;;;;1;12;1;;;
2079;20;388;kn Getso Maternal and Child Health Clinic;Rural;;0;;;;1;12;1;;;
2080;20;388;kn Gwarzo General Hospital;Urban;;0;;;;1;12;1;;;EVCDM84gVrc
2081;20;388;kn Jama a Primary Health Centre;Rural;;0;;;;1;12;1;;;
2082;20;388;kn Kutama Primary Health Centre;Rural;;0;;;;1;12;1;;;
2083;20;388;kn Lakwaya Basic Health Centre;Rural;;0;;;;1;12;1;;;
2084;20;388;kn Madadi Basic Health Centre;Rural;;0;;;;1;12;1;;;
2085;20;388;kn Yarkasuwa Dispensary;Rural;;0;;;;1;12;1;;;
2086;20;389;kn Balan Health Post (KAB);Rural;;0;;;;1;12;1;;;
2087;20;389;kn Dugabau Health Post;Rural;;0;;;;1;12;1;;;
2088;20;389;kn Durun Maternal and Child Health Centre;Rural;;0;;;;1;12;1;;;
2089;20;389;kn Gamo Primary Health Centre;Rural;;0;;;;1;12;1;;;
2090;20;389;kn Garo Primary Health Centre;Rural;;0;;;;1;12;1;;;
2091;20;389;kn Godiya Health Post;Rural;;0;;;;1;12;1;;;
2092;20;389;kn Gude Primary Health Centre;Rural;;0;;;;1;12;1;;;
2093;20;389;kn Hawan Bago Health Post;Rural;;0;;;;1;12;1;;;
2094;20;389;kn Kabo General Hospital;Urban;;0;;;;1;12;1;;;
2095;20;389;kn Kanwa Health Post (KBK);Rural;;0;;;;1;12;1;;;
2096;20;389;kn Masanawa Health Post;Rural;;0;;;;1;12;1;;;
2097;20;390;kn Al-Iman Clinic;Urban;;0;;;;1;12;1;;;
2098;20;390;kn Community Health Research Initiative;Urban;;0;;;;1;12;1;;;
2099;20;390;kn Emirs Palace Primary Health Centre;Urban;;0;;;;1;12;1;;;
2100;20;390;kn Fuskar Gabas Health Post;Urban;;0;;;;1;12;1;;;
2101;20;390;kn Gandu Model Primary Health Centre;Urban;;0;;;;1;12;1;;;
2102;20;390;kn Hasiya Bayero Paediatric Hospital;Urban;;0;;;;1;12;1;;;RHLPUEDKJTO
2103;20;390;kn Heal Tune Clinic;Urban;;0;;;;1;12;1;;;
2104;20;390;kn Mayanka Primary Health Centre;Urban;;0;;;;1;12;1;;;
2105;20;390;kn Murtala Mohammed Specialist Hospital;Urban;;0;;;;1;12;1;;;MI3hLVjIws5
2106;20;390;kn Nuhu Bamalli Maternity Hospital;Urban;;0;;;;1;12;1;;;JFPyJJ7irKh
2107;20;390;kn Sabo Bakin Zuwo Maternity Hospital;Urban;;0;;;;1;12;1;;;
2108;20;390;kn Saymays Specialist Hospital;Urban;;0;;;;1;12;1;;;
2109;20;390;kn Sharada Primary Health Centre;Urban;;0;;;;1;12;1;;;
2110;20;390;kn Support for Women and Teenage Children (SWATCH);Urban;;0;;;;1;12;1;;;
2111;20;390;kn Tukuntawa Primary Health Centre;Urban;;0;;;;1;12;1;;;
2112;20;390;kn Unguwar Gini Primary Health Centre;Urban;;0;;;;1;12;1;;;
2113;20;390;kn Vintage Clinic;Urban;;0;;;;1;12;1;;;
2114;20;390;kn Yakasai Zumunta Health Post;Urban;;0;;;;1;12;1;;;
2115;20;390;kn Yan Awaki Primary Health Centre;Urban;;0;;;;1;12;1;;;
2116;20;395;kn Gidan Nissau Primary Health Centre;Rural;;0;;;;1;12;1;;;
2117;20;395;kn Gwadama Health Post;Rural;;0;;;;1;12;1;;;
2118;20;395;kn Gwarmai Primary Health Centre (KNC);Rural;;0;;;;1;12;1;;;
2119;20;395;kn Karofawa Health Post;Rural;;0;;;;1;12;1;;;
2120;20;395;kn Kasuwar Model Primary Health Centre;Rural;;0;;;;1;12;1;;;
2121;20;395;kn Kunchi Primary Health Centre;Rural;;0;;;;1;12;1;;;
2122;20;395;kn Matan Fada Dispensary;Rural;;0;;;;1;12;1;;;
2123;20;395;kn Shuwaki Model Primary Health Centre;Rural;;0;;;;1;12;1;;;
2124;20;395;kn Unguwar Gyartai Primary Health Centre;Rural;;0;;;;1;12;1;;;
2125;20;395;kn Yandadi Model Primary Health Centre;Rural;;0;;;;1;12;1;;;
2126;20;396;kn Azore Health Centre;Rural;;0;;;;1;12;1;;;
2127;20;396;kn Bugan Health Centre;Rural;;0;;;;1;12;1;;;
2128;20;396;kn Danhassan Health Centre;Rural;;0;;;;1;12;1;;;
2129;20;396;kn Danhassan Primary Health Centre;Rural;;0;;;;1;12;1;;;
2130;20;396;kn Dukawa Health Centre;Rural;;0;;;;1;12;1;;;
2131;20;396;kn Gadan Ali Health Centre;Rural;;0;;;;1;12;1;;;
2132;20;396;kn Gainawa A Health Centre;Rural;;0;;;;1;12;1;;;
2133;20;396;kn Gainawa B Health Centre;Rural;;0;;;;1;12;1;;;
2134;20;396;kn Gajingiri Health Centre;Rural;;0;;;;1;12;1;;;
2135;20;396;kn Gundutse Health Centre;Rural;;0;;;;1;12;1;;;
2136;20;396;kn Hadeja Jama are Health Centre;Rural;;0;;;;1;12;1;;;
2137;20;396;kn Imawa Health Post;Rural;;0;;;;1;12;1;;;
2138;20;396;kn Kadani Health Centre;Rural;;0;;;;1;12;1;;;
2139;20;396;kn Kirya Health Centre;Rural;;0;;;;1;12;1;;;
2140;20;396;kn Kura General Hospital;Urban;;0;;;;1;12;1;;;qkQLc203fsM
2141;20;396;kn Kura surgery & Maternity Clinic;Rural;;0;;;;1;12;1;;;
2142;20;396;kn Rimin kwarya Health Centre;Rural;;0;;;;1;12;1;;;
2143;20;396;kn Sa adatu Private Clinic & Maternity;Rural;;0;;;;1;12;1;;;
2144;20;396;kn Sani Marshal Maternity Centre;Rural;;0;;;;1;12;1;;;
2145;20;396;kn Yarkanya Health Centre;Rural;;0;;;;1;12;1;;;
2146;20;398;kn Bare Bari Health Centre;Rural;;0;;;;1;12;1;;;
2147;20;398;kn Dr Wada Wazari Basic Health Centre;Rural;;0;;;;1;12;1;;;
2148;20;398;kn Dunawa Health Post;Rural;;0;;;;1;12;1;;;
2149;20;398;kn Jibga Health Post (MKD);Rural;;0;;;;1;12;1;;;
2150;20;398;kn Kantudu Health Post;Rural;;0;;;;1;12;1;;;
2151;20;398;kn Koguna Health Centre;Rural;;0;;;;1;12;1;;;
2152;20;398;kn Kurna Health Post;Rural;;0;;;;1;12;1;;;
2153;20;398;kn Mai Tsidau Health Centre;Rural;;0;;;;1;12;1;;;
2154;20;398;kn Makoda Primary Health Centre;Rural;;0;;;;1;12;1;;;
2155;20;398;kn Sabon Ruwa Health Centre;Rural;;0;;;;1;12;1;;;
2156;20;398;kn Shantake Health Post;Rural;;0;;;;1;12;1;;;
2157;20;398;kn Wailare Health Centre;Rural;;0;;;;1;12;1;;;
2158;20;398;kn Walawa Health Centre;Rural;;0;;;;1;12;1;;;
2159;20;400;kn Society for Women and Aids in Africa Nigeria CSO (Kano);Urban;;0;;;;1;12;1;;;
2160;20;401;kn Madachi Health Post;Rural;;0;;;;1;12;1;;;
2161;20;401;kn Rano Dawaki Health Clinic;Rural;;0;;;;1;12;1;;;
2162;20;401;kn Rano General Hospital;Urban;;0;;;;1;12;1;;;ldni2yzxkeF
2163;20;401;kn Rurum Health Centre;Rural;;0;;;;1;12;1;;;
2164;20;401;kn Saji Health Centre;Rural;;0;;;;1;12;1;;;
2165;20;401;kn Tabobi Health Post;Rural;;0;;;;1;12;1;;;
2166;20;401;kn Taitai Health Centre;Rural;;0;;;;1;12;1;;;
2167;20;401;kn Yalwa Health Post (RAN);Rural;;0;;;;1;12;1;;;
2168;20;402;kn Yelwa Primary Health centre;Rural;;0;;;;1;12;1;;;
2169;20;402;kn Rimin Gado Comprehensive Health Centre;Rural;;0;;;;1;12;1;;;
2170;20;403;kn Barbarji Health Post;Rural;;0;;;;1;12;1;;;
2171;20;403;kn Bari Model Primary Health Centre;Rural;;0;;;;1;12;1;;;
2172;20;403;kn Beli Basic Health Centre;Rural;;0;;;;1;12;1;;;
2173;20;403;kn Falgore Primary Health Centre (Rogo);Rural;;0;;;;1;12;1;;;
2174;20;403;kn Fultan Basic Health Clinic;Rural;;0;;;;1;12;1;;;
2175;20;403;kn Gwangwan Health Post;Rural;;0;;;;1;12;1;;;
2176;20;403;kn Kaleku Health Centre;Rural;;0;;;;1;12;1;;;
2177;20;403;kn Rogo General Hospital;Rural;;0;;;;1;12;1;;;dWH4Pf6d3E1
2178;20;403;kn Rogo Tsohuwar Health Post;Rural;;0;;;;1;12;1;;;
2179;20;403;kn Sabon Layin Haro Health Post;Rural;;0;;;;1;12;1;;;
2180;20;403;kn Sundu Health Centre;Rural;;0;;;;1;12;1;;;
2181;20;403;kn Unguwar Malan Health Centre;Rural;;0;;;;1;12;1;;;
2182;20;403;kn Zarewa Basic Health Centre;Rural;;0;;;;1;12;1;;;
2183;20;403;kn Zoza Health Post;Rural;;0;;;;1;12;1;;;
2184;20;404;kn Shanono Primary Health Care Centre;Rural;;0;;;;1;12;1;;;
2185;20;404;kn Faruruwa Basic Health Centre;Rural;;0;;;;1;12;1;;;
2186;20;404;kn Leni Basic Health Centre;Rural;;0;;;;1;12;1;;;
2187;20;404;kn Tsaure Basic Health Centre;Rural;;0;;;;1;12;1;;;
2188;20;405;kn Gala Health Post;Rural;;0;;;;1;12;1;;;
2189;20;405;kn Gani Health Centre;Rural;;0;;;;1;12;1;;;
2190;20;405;kn Garfa Health Post;Rural;;0;;;;1;12;1;;;
2191;20;405;kn Gomo Basic Health Centre;Rural;;0;;;;1;12;1;;;
2192;20;405;kn Kanawa Health Post;Rural;;0;;;;1;12;1;;;
2193;20;405;kn Karofi Health Post;Rural;;0;;;;1;12;1;;;
2194;20;405;kn Magami Basic Health Centre;Rural;;0;;;;1;12;1;;;
2195;20;405;kn Massu Basic Health Centre;Rural;;0;;;;1;12;1;;;
2196;20;405;kn Patricia Maternal and Child Health Centre;Rural;;0;;;;1;12;1;;;
2197;20;405;kn Rimi Basic Health Centre;Rural;;0;;;;1;12;1;;;
2198;20;405;kn Rumo Health Post;Rural;;0;;;;1;12;1;;;
2199;20;405;kn Sitti Basic Health Centre;Rural;;0;;;;1;12;1;;;
2200;20;405;kn Sumaila General Hospital;Urban;;0;;;;1;12;1;;;LCjPSP6NXnx
2201;20;396;kn Karfi Health Centre;Rural;;0;;;;1;12;1;;;
2202;20;411;kn Kadawa Ciki Health Post;Rural;;0;;;;1;12;1;;;
2203;20;412;kn Danfari Health Centre;Rural;;0;;;;1;12;1;;;
2204;20;412;kn Danlasan Basic Health Clinic;Rural;;0;;;;1;12;1;;;
2205;20;412;kn Gogel Basic Health Centre;Rural;;0;;;;1;12;1;;;
2206;20;412;kn Imawa Health Centre;Rural;;0;;;;1;12;1;;;
2207;20;412;kn Jemagu Health Post;Rural;;0;;;;1;12;1;;;
2208;20;412;kn Jigawa Health Post;Rural;;0;;;;1;12;1;;;
2209;20;412;kn Jumar Galadima Dispensary;Rural;;0;;;;1;12;1;;;
2210;20;412;kn Katarkawa Health Centre;Rural;;0;;;;1;12;1;;;
2211;20;412;kn Tnagar Dispensary;Rural;;0;;;;1;12;1;;;
2212;20;412;kn Tungar Gabas Health Centre;Rural;;0;;;;1;12;1;;;
2213;20;412;kn Wambato Health Post;Rural;;0;;;;1;12;1;;;
2214;20;412;kn Warawa Primary Health Clinic;Rural;;0;;;;1;12;1;;;
2215;20;412;kn Yandalla Health Centre;Rural;;0;;;;1;12;1;;;
2216;20;412;kn Yar Tofa Health Post (WRA);Rural;;0;;;;1;12;1;;;
2217;25;506;la Adams Hospital;Urban;;0;;;;1;12;1;;;NEFSZH81JQe
2218;25;506;la Broad Hospital;Urban;;0;;;;1;12;1;;;r7xijNaqTNb
2219;25;506;la Dopemu Primary Health Centre;Urban;;0;;;;1;12;1;;;T6o9Nh2CiUF
2220;25;506;la Iloro Primary Health Centre;Urban;;0;;;;1;12;1;;;YZHycfjkxM3
2221;25;506;la Mobonike Hospital;Urban;;0;;;;1;12;1;;;A4hw6FQpJfX
2222;25;506;la Odunbaku Primary Health Centre;Urban;;0;;;;1;12;1;;;Y5ReWuj8W1M
2223;25;506;la Olive Medicare Hospital;Urban;;0;;;;1;12;1;;;kemOovArAIT
2224;25;506;la Orile Agege General Hospital;Urban;;0;;;;1;12;1;;;XxYNIkLVpEa
2225;25;506;la Papa Uku Primary Health Centre;Urban;;0;;;;1;12;1;;;nYcntjjaiPZ
2226;25;506;la Powerline Primary Health Centre;Urban;;0;;;;1;12;1;;;NhvF5diSS13
2227;25;506;la Promise Medical Centre;Urban;;0;;;;1;12;1;;;wzSzRiZrZTF
2228;25;506;la Sango Primary Health Centre;Urban;;0;;;;1;12;1;;;EnyrCHOxsJ3
2229;25;506;la Unita Hospital;Urban;;0;;;;1;12;1;;;bJl8BHYrNFG
2230;25;507;la Ajeromi General Hospital;Urban;;0;;;;1;12;1;;;SEyGljwDspr
2231;25;507;la Akere Primary Health Centre;Urban;;0;;;;1;12;1;;;J7FjUrPb2sL
2232;25;507;la All Souls Hospital;Urban;;0;;;;1;12;1;;;lzLciumbY6G
2233;25;507;la Amukoko Primary Health Centre;Urban;;0;;;;1;12;1;;;QynRyL8KjTi
2234;25;507;la Dako Medical Centre Limited;Urban;;0;;;;1;12;1;;;gmCF4umwzM4
2235;25;507;la Faleti Medical Centre;Urban;;0;;;;1;12;1;;;PoaLWGah1Ft
2236;25;507;la Ibafon Primary Health Centre;Urban;;0;;;;1;12;1;;;godWz2Ow5k3
2237;25;507;la Layeni Primary Health Centre;Urban;;0;;;;1;12;1;;;K7lUFNe9aXC
2238;25;507;la Natafod Consultants Hospital;Urban;;0;;;;1;12;1;;;NczR0Uby5N7
2239;25;507;la Oridili Primary Health Centre;Urban;;0;;;;1;12;1;;;
2240;25;507;la Saseun Hospital and Maternity;Urban;;0;;;;1;12;1;;;ad4Mire6vFt
2241;25;507;la Shammah Specialist Hospital;Urban;;0;;;;1;12;1;;;oPBiwEqwv0h
2242;25;507;la St Theresa Hospital;Urban;;0;;;;1;12;1;;;
2243;25;507;la Tolu Medical Centre;Urban;;0;;;;1;12;1;;;ApY34SntXNd
2244;25;507;la Tolu Primary Health Centre;Urban;;0;;;;1;12;1;;;be2XWFgdUFW
2245;25;510;la Ahamadiyya Muslim Hospital;Urban;;0;;;;1;12;1;;;my3FxDlRhzI
2246;25;510;la Apapa General Hospital;Urban;;0;;;;1;12;1;;;bPHCezfUwaP
2247;25;510;la Apapa Specialist Hospital;Urban;;0;;;;1;12;1;;;KOOM1XhkTx6
2248;25;510;la Iduna Specialist Hospital;Urban;;0;;;;1;12;1;;;ElQJpW9yWEN
2249;25;510;la Ijora Primary Health Centre;Urban;;0;;;;1;12;1;;;cgvllBRlUt6
2250;25;510;la Jim Sam Hospital and Maternity;Urban;;0;;;;1;12;1;;;kfoH2nPwGqs
2251;25;510;la Olojowon Primary Health Centre;Urban;;0;;;;1;12;1;;;wh1fufa69db
2252;25;510;la Oluwole Primary Health Centre;Urban;;0;;;;1;12;1;;;dsIqOTu5Fgn
2253;25;510;la Sacred Heart Clinic;Urban;;0;;;;1;12;1;;;gXNwPNpiX7D
2254;25;510;la Sari Primary Health Centre;Urban;;0;;;;1;12;1;;;PROyclKUpiF
2255;25;511;la A Harmony Hospital;Rural;;0;;;;1;12;1;;;tLVBiwjEDz5
2256;25;511;la Access Hospital;Rural;;0;;;;1;12;1;;;
2257;25;511;la Ajara Primary Health Centre;Rural;;0;;;;1;12;1;;;HOosZvIOTVg
2258;25;511;la Anthony Cardinal Okogie Maternity Hospital;Rural;;0;;;;1;12;1;;;
2259;25;511;la Apa Primary Health Centre;Rural;;0;;;;1;12;1;;;Pz2IHYq2xsD
2260;25;511;la AppleYard Hospital;Rural;;0;;;;1;12;1;;;
2261;25;511;la Asheri Muri Clinic;Rural;;0;;;;1;12;1;;;
2262;25;511;la Badagry General Hospital;Rural;;0;;;;1;12;1;;;UzCw35LZV95
2263;25;511;la Farasime Primary Health Centre;Rural;;0;;;;1;12;1;;;
2264;25;511;la Great Phys Clinic;Rural;;0;;;;1;12;1;;;
2265;25;511;la Igbogbele Primary Health Centre;Rural;;0;;;;1;12;1;;;
2266;25;511;la Ilogbo Primary Health Centre;Rural;;0;;;;1;12;1;;;
2267;25;511;la Marina Primary Health Centre;Rural;;0;;;;1;12;1;;;wCuy1H8rBOV
2268;25;511;la Mogogbo Primary Health Centre;Rural;;0;;;;1;12;1;;;
2269;25;511;la Mowo Primary Health Centre;Rural;;0;;;;1;12;1;;;X0dzsuGz8oJ
2270;25;511;la Pota Primary Health Centre;Rural;;0;;;;1;12;1;;;Q10hueJWdFP
2271;25;511;la Sacred Heart Catholic Clinic (Badagry);Rural;;0;;;;1;12;1;;;
2272;25;511;la Sakpo Primary Health Centre;Rural;;0;;;;1;12;1;;;
2273;25;511;la Salvation Army Clinic;Rural;;0;;;;1;12;1;;;
2274;25;511;la Seme Primary Health Centre;Rural;;0;;;;1;12;1;;;aGuDfDDP3kA
2275;25;511;la Topo Primary Health Centre;Rural;;0;;;;1;12;1;;;
2276;25;517;la Humanity Family Foundation For Peace and Development;Urban;;0;;;;1;12;1;;;
2277;25;518;la Afrimed Specialist Hospital;Urban;;0;;;;1;12;1;;;
2278;25;518;la Agboyi-Ketu Primary Health Centre;Urban;;0;;;;1;12;1;;;
2279;25;518;la Ajegunle Primary Health Centre;Urban;;0;;;;1;12;1;;;
2280;25;518;la Alapere Primary Health Centre;Urban;;0;;;;1;12;1;;;
2281;25;518;la Ameso Specialist Hospital;Urban;;0;;;;1;12;1;;;
2282;25;518;la Aniyun Hospital;Urban;;0;;;;1;12;1;;;
2283;25;518;la Folabi Medical Centre;Urban;;0;;;;1;12;1;;;INzIu8G8zKP
2284;25;518;la Gbagada General Hospital;Urban;;0;;;;1;12;1;;;rp69pX7NNl2
2285;25;518;la Horeb Consult Hospital;Urban;;0;;;;1;12;1;;;
2286;25;518;la Ikosi Primary Health Centre;Urban;;0;;;;1;12;1;;;
2287;25;518;la Isheri Primary Health Centre;Urban;;0;;;;1;12;1;;;
2288;25;518;la Jacon Davids Hospital;Urban;;0;;;;1;12;1;;;
2289;25;518;la Ketu Primary Health Centre;Urban;;0;;;;1;12;1;;;DpZOtdkfW60
2290;25;518;la Maidan Primary Health Centre;Urban;;0;;;;1;12;1;;;
2291;25;518;la Med-In-Specialist Hospital;Urban;;0;;;;1;12;1;;;
2292;25;518;la Mende Primary Health Centre;Urban;;0;;;;1;12;1;;;
2293;25;518;la Ogudu Primary Health Centre;Urban;;0;;;;1;12;1;;;
2294;25;518;la Oworo Primary Health Centre;Urban;;0;;;;1;12;1;;;
2295;25;518;la The Word Bible Church Maternity Home;Urban;;0;;;;1;12;1;;;
2296;25;519;la Agarawu Primary Health Centre;Urban;;0;;;;1;12;1;;;
2297;25;519;la Ajike Samsa Hospital;Urban;;0;;;;1;12;1;;;
2298;25;519;la Dumare Chest Clinic;Urban;;0;;;;1;12;1;;;
2299;25;519;la Forsight Medical Centre (TFF) Primary Health Centre;Urban;;0;;;;1;12;1;;;
2300;25;519;la Hanoba Primary Health Centre;Urban;;0;;;;1;12;1;;;
2301;25;519;la Iga Idugaran Primary Health Centre;Urban;;0;;;;1;12;1;;;Nid1f3KACfp
2302;25;519;la Lagos General Hospital;Urban;;0;;;;1;12;1;;;zyxDXEYBxqA
2303;25;519;la Lagos Island Maternity Hospital;Urban;;0;;;;1;12;1;;;ixltW74M2ch
2304;25;519;la Massey Street Childrens Hospital;Urban;;0;;;;1;12;1;;;Zuz01IzErgM
2305;25;519;la Oba Adeyinka Oyekan (Adenihi Adele) Primary Health Centre;Urban;;0;;;;1;12;1;;;UiISOtUQL0r
2306;25;519;la Olowogbowo Primary Health Centre;Urban;;0;;;;1;12;1;;;
2307;25;519;la Omni Medical Centre;Urban;;0;;;;1;12;1;;;
2308;25;519;la Onikan Health Centre;Urban;;0;;;;1;12;1;;;rbNoobbUgpn
2309;25;519;la Sura Primary Health Centre;Urban;;0;;;;1;12;1;;;s3DOqj9T8aD
2310;25;520;la Abule-Nla Primary Health Centre;Urban;;0;;;;1;12;1;;;rVNXo0ENWa7
2311;25;520;la Alli-Dawodu Primary Health Centre;Urban;;0;;;;1;12;1;;;
2312;25;520;la Almat Medical Centre;Urban;;0;;;;1;12;1;;;
2313;25;520;la Blissful Life for Youth Society of Nigeria;Urban;;0;;;;1;12;1;;;
2314;25;520;la Federal Medical Centre;Urban;;0;;;;1;12;1;;;
2315;25;520;la Harvey Road Comprehensive Health Centre;Urban;;0;;;;1;12;1;;;zvv5uWH8hNf
2316;25;520;la Hoares Memorial Methodist Cathedral Yaba Clinic;Urban;;0;;;;1;12;1;;;
2317;25;520;la JAKINS Ministry;Urban;;0;;;;1;12;1;;;
2318;25;520;la Lagos State Mainland Hospital;Urban;;0;;;;1;12;1;;;kzjkCk8UnGR
2319;25;520;la Mainland Anglican Hospital;Urban;;0;;;;1;12;1;;;
2320;25;520;la Mount Sinai Hospital (Lagoa Mainland);Urban;;0;;;;1;12;1;;;
2321;25;520;la Oba Salami Primary Health Centre;Urban;;0;;;;1;12;1;;;jEw8VVNHRtG
2322;25;520;la Otto Primary Health Centre;Urban;;0;;;;1;12;1;;;
2323;25;520;la RCCG-Redeemed Aid Programme Action Committee CSO (Lagos);Urban;;0;;;;1;12;1;;;FMV3Cu3WZmN
2324;25;520;la Simpson Primary Health Centre;Urban;;0;;;;1;12;1;;;PeH3XKs9FBu
2325;25;520;la St Lukes Hospital;Urban;;0;;;;1;12;1;;;
2326;25;522;la Afromedia Primary Health Centre;Urban;;0;;;;1;12;1;;;
2327;25;522;la Al-Hayat Medial Centre;Urban;;0;;;;1;12;1;;;
2328;25;522;la Elphy Hospital;Urban;;0;;;;1;12;1;;;
2329;25;522;la Elshaddai Hospital and Lab;Urban;;0;;;;1;12;1;;;
2330;25;522;la Era Mini Primary Health Centre;Urban;;0;;;;1;12;1;;;frNn4pdtsqr
2331;25;522;la Iba Primary Health Centre;Urban;;0;;;;1;12;1;;;Gm09bC53qeR
2332;25;522;la Igbede Primary Health Centre;Rural;;0;;;;1;12;1;;;
2333;25;522;la Ijagemo Primary Health Centre;Rural;;0;;;;1;12;1;;;
2334;25;522;la Ijanikin Primary Health Centre;Rural;;0;;;;1;12;1;;;TzhekAB5jNB
2335;25;522;la Ijedodo Primary Health Centre;Rural;;0;;;;1;12;1;;;
2336;25;522;la Imude Primary Health Centre;Urban;;0;;;;1;12;1;;;
2337;25;522;la Irewe Primary Health Centre;Rural;;0;;;;1;12;1;;;
2338;25;522;la Isashi Primary Health Centre;Rural;;0;;;;1;12;1;;;
2339;25;522;la Ishagira Primary Health Centre;Rural;;0;;;;1;12;1;;;
2340;25;522;la Kemberi Primary Health Centre;Urban;;0;;;;1;12;1;;;
2341;25;522;la Ojo Primary Health Centre;Urban;;0;;;;1;12;1;;;YE1lCEtYmen
2342;25;522;la Okoko Primary Health Centre;Urban;;0;;;;1;12;1;;;
2343;25;522;la Oyems Hospital;Urban;;0;;;;1;12;1;;;jYwlPVWe1Of
2344;25;522;la Redeemed Medial Centre;Urban;;0;;;;1;12;1;;;
2345;25;522;la Shibiri Primary Health Centre;Rural;;0;;;;1;12;1;;;
2346;25;524;la Bajulaiye Primary Health Centre;Urban;;0;;;;1;12;1;;;
2347;25;524;la CMS Primary Health Centre;Urban;;0;;;;1;12;1;;;
2348;25;524;la Jon Ken Hospital;Urban;;0;;;;1;12;1;;;
2349;25;524;la Ladilak Medical Centre;Urban;;0;;;;1;12;1;;;QHUlQhM8xbC
2350;25;524;la Osuntuyi Medical Centre;Urban;;0;;;;1;12;1;;;
2351;25;524;la R Jolad Hospital;Urban;;0;;;;1;12;1;;;jqzAWd7hBmC
2352;25;524;la We Care Hospital;Urban;;0;;;;1;12;1;;;
2353;25;525;la Akerela Primary Health Centre;Urban;;0;;;;1;12;1;;;pHurIQKNsWD
2354;25;525;la Angel Hospital;Urban;;0;;;;1;12;1;;;Xv3i86fz8X7
2355;25;525;la Anjorin Primary Health Centre;Urban;;0;;;;1;12;1;;;k4Bh8Ybj0TI
2356;25;525;la Baruwa Primary Health Centre;Urban;;0;;;;1;12;1;;;JOqyhnhH3M4
2357;25;525;la Coker Aguda Primary Health Centre;Urban;;0;;;;1;12;1;;;oi20uK7Rp5J
2358;25;525;la Duro-Oyedoyin Primary Health Centre;Urban;;0;;;;1;12;1;;;v9uFBwZQ03j
2359;25;525;la Ejire Primary Health Centre;Urban;;0;;;;1;12;1;;;uaMxMXAlb8k
2360;25;525;la First Faith Medical Centre;Urban;;0;;;;1;12;1;;;USrTyZidFRU
2361;25;525;la Havana Specialist Hospital;Urban;;0;;;;1;12;1;;;
2362;25;525;la Orile Primary Health Centre;Urban;;0;;;;1;12;1;;;tdHJlJ24DRu
2363;25;525;la Randle General Hospital;Urban;;0;;;;1;12;1;;;J3Rct6AHcSm
2364;25;525;la Salus Infirmorum Catholic Hospital;Urban;;0;;;;1;12;1;;;PEpg04JumzO
2365;25;525;la Surulere Able God Hosital;Urban;;0;;;;1;12;1;;;VBdvUQ1IMCj
2366;25;525;la Surulere Mezonel Hospital;Urban;;0;;;;1;12;1;;;P0Hdzdt87qy
2367;25;525;la Surulere The Family Clinic;Urban;;0;;;;1;12;1;;;DCKSFia8ng7
2368;25;525;la Tree of Life Hospital;Urban;;0;;;;1;12;1;;;
2369;33;682;ri Abua General Hospital;Rural;;0;;;;1;12;1;;;s7iNeUuoOz1
2370;33;682;ri Agada Model Primary Health Centre;Rural;;0;;;;1;12;1;;;
2371;33;682;ri Aminigboko Cottage Hospital;Rural;;0;;;;1;12;1;;;
